{
  "$schema": "https://json-schema.org/draft/2020-12/schema",
  "$id": "https://github.com/chrober/bliss-playlist-optimizer/schemas/optimizer-request-v1.schema.json",
  "title": "Bliss playlist optimizer request v1",
  "type": "object",
  "additionalProperties": false,
  "required": [
    "schema_version",
    "job_id",
    "artifacts",
    "source_tracks",
    "scoring",
    "route",
    "repeat_windows",
    "extension",
    "semantic_evidence",
    "output"
  ],
  "properties": {
    "schema_version": { "const": 1 },
    "job_id": { "type": "string", "minLength": 1, "maxLength": 128 },
    "artifacts": {
      "type": "object",
      "additionalProperties": false,
      "required": ["database"],
      "properties": {
        "database": { "$ref": "#/$defs/artifact" },
        "learned_matrix": { "$ref": "#/$defs/artifact" },
        "local_candidate_inventory": { "$ref": "#/$defs/artifact" },
        "candidate_identities": { "$ref": "#/$defs/artifact" },
        "track_identities": { "$ref": "#/$defs/artifact" }
      }
    },
    "source_tracks": {
      "type": "array",
      "minItems": 2,
      "items": { "$ref": "#/$defs/trackIdentity" }
    },
    "history_tracks": {
      "type": "array",
      "description": "Ordered immutable listening history, oldest to newest. Repeated identities are allowed and constrain only newly generated destination-route members.",
      "items": { "$ref": "#/$defs/trackIdentity" }
    },
    "scoring": {
      "type": "object",
      "additionalProperties": false,
      "required": ["algorithm"],
      "properties": {
        "algorithm": {
          "enum": ["euclidean", "weighted_euclidean", "learned_matrix", "adaptive", "static"]
        },
        "feature_weights": {
          "type": "array",
          "minItems": 23,
          "maxItems": 23,
          "items": { "type": "number", "minimum": 0 }
        },
        "adaptive": {
          "type": "object",
          "additionalProperties": false,
          "required": ["seed_limit", "learned_percent"],
          "properties": {
            "seed_limit": { "type": "integer", "minimum": 1 },
            "learned_percent": { "type": "integer", "minimum": 0, "maximum": 100 }
          }
        },
        "captured_blissmixer_preferences": {
          "type": "object",
          "description": "Redacted, immutable preferences used to derive this scoring configuration."
        }
      },
      "allOf": [
        {
          "if": { "properties": { "algorithm": { "enum": ["adaptive", "static"] } } },
          "then": { "required": ["adaptive"] }
        }
      ]
    },
    "selection": {
      "type": "object",
      "additionalProperties": false,
      "required": ["variation_percent", "generation_seed"],
      "properties": {
        "variation_percent": {
          "type": "integer",
          "minimum": 0,
          "maximum": 100,
          "description": "Strategy-neutral amount of seeded membership and route variation. Zero preserves strict best-match selection."
        },
        "generation_seed": {
          "type": "integer",
          "minimum": 0,
          "description": "Reproducible per-job seed used by every scoring strategy and selection workflow."
        }
      }
    },
    "candidate_policy": {
      "type": "object",
      "additionalProperties": false,
      "properties": {
        "genre": {
          "type": "object",
          "additionalProperties": false,
          "required": [
            "restrict_genres",
            "exclude_christmas",
            "genre_groups",
            "match_all_genres",
            "use_track_genre"
          ],
          "properties": {
            "restrict_genres": { "type": "boolean" },
            "exclude_christmas": {
              "type": "boolean",
              "description": "Effective captured Christmas exclusion. Callers disable it for requests started in December."
            },
            "genre_groups": {
              "type": "array",
              "items": {
                "type": "array",
                "minItems": 1,
                "items": { "type": "string", "minLength": 1 }
              }
            },
            "match_all_genres": { "type": "boolean" },
            "use_track_genre": { "type": "boolean" }
          }
        }
      }
    },
    "route": {
      "type": "object",
      "additionalProperties": false,
      "required": ["ordering_policy", "objective", "search"],
      "properties": {
        "ordering_policy": {
          "enum": ["optimize_order", "preserve_order", "queue_destination"]
        },
        "objective": {
          "enum": ["sum", "mean", "bottleneck_then_sum"]
        },
        "start_track_id": { "type": "string" },
        "destination_track_id": { "type": "string" },
        "destination_track_ids": {
          "type": "array",
          "minItems": 1,
          "uniqueItems": true,
          "items": { "type": "string", "minLength": 1 }
        },
        "rejoin_track_id": { "type": "string" },
        "search": {
          "type": "object",
          "additionalProperties": false,
          "required": ["deterministic_seed", "restart_count"],
          "properties": {
            "deterministic_seed": { "type": "integer", "minimum": 0 },
            "restart_count": { "type": "integer", "minimum": 0 },
            "candidate_limit": { "type": "integer", "minimum": 1 },
            "time_budget_ms": { "type": "integer", "minimum": 1 }
          }
        }
      }
    },
    "repeat_windows": {
      "type": "object",
      "additionalProperties": false,
      "required": ["artist", "album", "track"],
      "properties": {
        "artist": { "type": "integer", "minimum": 0 },
        "album": { "type": "integer", "minimum": 0 },
        "track": { "type": "integer", "minimum": 0 },
        "artist_identity_mode": {
          "enum": ["shared_artist", "primary_artist", "exact_bliss_credit"],
          "default": "exact_bliss_credit"
        }
      }
    },
    "extension": {
      "type": "object",
      "additionalProperties": false,
      "required": ["mode"],
      "properties": {
        "mode": {
          "enum": ["none", "automatic", "exact_count", "fixed_gap_count", "repeat_window_repair", "fixed_source_extension", "destination_route", "one_per_transition", "target_length"]
        },
        "additional_track_count": { "type": "integer", "minimum": 0 },
        "search_effort": { "enum": ["fast", "balanced", "thorough"] },
        "destination_mode": { "enum": ["automatic", "exact"] },
        "allow_opening_track": { "type": "boolean" },
        "allow_closing_track": { "type": "boolean" },
        "target_track_count": { "type": "integer", "minimum": 2 },
        "candidate_limit": { "type": "integer", "minimum": 1 },
        "max_tracks_per_gap": { "type": "integer", "minimum": 1, "maximum": 8 },
        "tracks_per_gap": { "type": "integer", "minimum": 1, "maximum": 8 },
        "gap_context_mode": { "enum": ["rolling", "frozen"] },
        "min_added_tracks": { "type": "integer", "minimum": 0, "maximum": 8 },
        "max_added_tracks": { "type": "integer", "minimum": 0 },
        "trigger_percentile": { "type": "number", "minimum": 0, "maximum": 1 },
        "direct_transition_caution": { "enum": ["normal", "cautious"] },
        "shortlist_limit": { "type": "integer", "minimum": 1, "maximum": 10000 }
      },
      "allOf": [
        {
          "if": {
            "properties": { "mode": { "const": "automatic" } }
          },
          "then": { "required": ["max_added_tracks", "trigger_percentile"] }
        },
        {
          "if": {
            "properties": { "mode": { "const": "exact_count" } }
          },
          "then": { "required": ["additional_track_count"] }
        },
        {
          "if": {
            "properties": { "mode": { "const": "fixed_gap_count" } }
          },
          "then": {
            "required": ["tracks_per_gap"],
            "not": {
              "anyOf": [
                { "required": ["additional_track_count"] },
                { "required": ["target_track_count"] },
                { "required": ["max_tracks_per_gap"] },
                { "required": ["max_added_tracks"] },
                { "required": ["trigger_percentile"] },
                { "required": ["allow_opening_track"] },
                { "required": ["allow_closing_track"] },
                { "required": ["destination_mode"] },
                { "required": ["min_added_tracks"] },
                { "required": ["direct_transition_caution"] },
                { "required": ["search_effort"] }
              ]
            }
          }
        },
        {
          "if": {
            "properties": { "mode": { "const": "fixed_source_extension" } }
          },
          "then": { "required": ["target_track_count"] }
        },
        {
          "if": {
            "properties": { "mode": { "const": "repeat_window_repair" } }
          },
          "then": {
            "required": ["max_added_tracks"],
            "not": {
              "anyOf": [
                { "required": ["additional_track_count"] },
                { "required": ["target_track_count"] },
                { "required": ["max_tracks_per_gap"] },
                { "required": ["tracks_per_gap"] },
                { "required": ["trigger_percentile"] },
                { "required": ["allow_opening_track"] },
                { "required": ["allow_closing_track"] },
                { "required": ["destination_mode"] },
                { "required": ["min_added_tracks"] },
                { "required": ["direct_transition_caution"] },
                { "required": ["search_effort"] }
              ]
            }
          }
        },
        {
          "if": {
            "properties": { "mode": { "const": "destination_route" } }
          },
          "then": {
            "required": ["destination_mode", "max_added_tracks", "trigger_percentile"],
            "allOf": [
              {
                "if": { "properties": { "destination_mode": { "const": "exact" } } },
                "then": {
                  "required": ["additional_track_count"],
                  "not": {
                    "anyOf": [
                      { "required": ["min_added_tracks"] },
                      { "required": ["direct_transition_caution"] }
                    ]
                  }
                }
              }
            ]
          }
        }
      ]
    },
    "semantic_evidence": { "$ref": "#/$defs/artifact" },
    "guidance_addons": {
      "type": "array",
      "description": "Optional trusted process guidance addons. Addon output is advisory and failures degrade to neutral guidance.",
      "items": {
        "type": "object",
        "required": ["id", "program"],
        "properties": {
          "id": { "type": "string", "minLength": 1 },
          "program": { "type": "string", "minLength": 1 },
          "args": { "type": "array", "items": { "type": "string" } },
          "options": { "type": "object" },
          "artifacts": {
            "type": "array",
            "items": {
              "type": "object",
              "required": ["kind", "path", "sha256"],
              "properties": {
                "kind": { "type": "string", "minLength": 1 },
                "path": { "type": "string", "minLength": 1 },
                "sha256": { "type": "string", "pattern": "^[a-f0-9]{64}$" }
              },
              "additionalProperties": false
            }
          },
          "resources": {
            "type": "array",
            "items": {
              "type": "object",
              "required": ["kind", "path", "access"],
              "properties": {
                "kind": { "type": "string", "minLength": 1 },
                "path": { "type": "string", "minLength": 1 },
                "access": { "const": "read_only" }
              },
              "additionalProperties": false
            }
          },
          "timeout_ms": { "type": "integer", "minimum": 1, "maximum": 300000 }
        },
        "additionalProperties": false
      }
    },
    "guidance_policy": {
      "type": "array",
      "description": "Trusted per-job advisory weights keyed by provider and provider-local channel.",
      "items": {
        "type": "object",
        "required": ["provider_id", "channel", "weight"],
        "properties": {
          "provider_id": { "type": "string", "minLength": 1 },
          "channel": { "type": "string", "minLength": 1 },
          "weight": { "type": "number", "minimum": -1, "maximum": 1 },
          "target_percent": { "type": "integer", "minimum": 0, "maximum": 100 }
        },
        "additionalProperties": false
      }
    },
    "output": {
      "type": "object",
      "additionalProperties": false,
      "required": ["include_private_paths", "include_rejected_candidates"],
      "properties": {
        "include_private_paths": { "type": "boolean" },
        "include_rejected_candidates": { "type": "boolean" },
        "max_rejected_candidates": { "type": "integer", "minimum": 0 }
      }
    }
  },
  "allOf": [
    {
      "if": {
        "properties": {
          "extension": { "required": ["tracks_per_gap"] }
        }
      },
      "then": {
        "properties": {
          "extension": {
            "properties": { "mode": { "const": "fixed_gap_count" } }
          }
        }
      }
    },
    {
      "if": {
        "properties": {
          "extension": { "required": ["max_tracks_per_gap"] }
        }
      },
      "then": {
        "properties": {
          "extension": {
            "properties": { "mode": { "const": "exact_count" } }
          }
        }
      }
    },
    {
      "if": {
        "properties": {
          "extension": {
            "required": ["max_tracks_per_gap"],
            "properties": {
              "max_tracks_per_gap": { "minimum": 2 }
            }
          }
        }
      },
      "then": {
        "properties": {
          "route": {
            "properties": {
              "ordering_policy": { "const": "preserve_order" }
            }
          }
        }
      }
    },
    {
      "if": {
        "properties": {
          "extension": {
            "anyOf": [
              { "required": ["allow_opening_track"] },
              { "required": ["allow_closing_track"] }
            ]
          }
        }
      },
      "then": {
        "properties": {
          "extension": {
            "properties": { "mode": { "const": "exact_count" } }
          }
        }
      }
    },
    {
      "if": {
        "properties": {
          "extension": {
            "properties": { "mode": { "const": "destination_route" } }
          }
        }
      },
      "then": {
        "properties": {
          "route": {
            "required": ["start_track_id", "destination_track_id"],
            "properties": {
              "ordering_policy": { "const": "queue_destination" }
            }
          }
        }
      },
      "else": {
        "properties": {
          "history_tracks": { "maxItems": 0 },
          "route": {
            "not": {
              "anyOf": [
                { "required": ["start_track_id"] },
                { "required": ["destination_track_id"] },
                { "required": ["destination_track_ids"] },
                { "required": ["rejoin_track_id"] }
              ]
            },
            "properties": {
              "ordering_policy": {
                "enum": ["optimize_order", "preserve_order"]
              }
            }
          }
        }
      }
    }
  ],
  "$defs": {
    "artifact": {
      "type": "object",
      "additionalProperties": false,
      "required": ["path"],
      "properties": {
        "path": { "type": "string", "minLength": 1 },
        "sha256": { "type": "string", "pattern": "^[a-fA-F0-9]{64}$" },
        "schema_identity": { "type": "string" },
        "cache_identity": { "type": "string", "minLength": 1, "maxLength": 256 }
      }
    },
    "trackIdentity": {
      "type": "object",
      "additionalProperties": false,
      "required": ["id", "lms_url"],
      "properties": {
        "id": { "type": "string", "minLength": 1 },
        "lms_url": { "type": "string", "minLength": 1 },
        "database_file": { "type": "string" },
        "title": { "type": "string" },
        "artist": { "type": "string" },
        "album": { "type": "string" },
        "recording_mbid": { "type": "string", "format": "uuid" },
        "artist_mbids": {
          "type": "array",
          "uniqueItems": true,
          "items": { "type": "string", "format": "uuid" }
        },
        "artist_identity_keys": {
          "type": "array",
          "uniqueItems": true,
          "items": { "type": "string", "minLength": 1 }
        },
        "primary_artist_identity_key": {
          "type": "string",
          "minLength": 1
        }
      }
    }
  }
}
